<?xml version="1.0" encoding="UTF-8"?>
<xs:schema xmlns:xs="http://www.w3.org/2001/XMLSchema" elementFormDefault="qualified" attributeFormDefault="unqualified">
	<xs:element name="CoursesWebsites" type="TCoursesWebsites">
		<xs:annotation>
			<xs:documentation>Definizione della tabella CourseWebsite</xs:documentation>
		</xs:annotation>
	</xs:element>
	
	<xs:complexType name="TCoursesWebsites" >
		<xs:sequence minOccurs="0" maxOccurs="unbounded">
			<xs:element name="CourseWebsite" type="TCourseWebsite" />
		</xs:sequence>
	</xs:complexType>
	
	<xs:complexType name="TCourseWebsite" >
		<xs:sequence minOccurs="1" maxOccurs="unbounded">
			<xs:element name="Course" type="xs:string" />
			<xs:element name="LinkDescription" type="TLinkDescription" />
		</xs:sequence>
	</xs:complexType>
	
	<xs:complexType name="TLinkDescription">
		<xs:sequence minOccurs="1" maxOccurs="1">
			<xs:element name="Link" type="xs:string" />
			<xs:element name="Description" type="xs:string" />
		</xs:sequence>
	</xs:complexType>
	
</xs:schema>
